{
	"schemaVersion": 1,
	"entityType": "taxonomy",
	"id": "fixture-condition-type",
	"domain": "condition",
	"purpose": "type",
	"terms": [
		{
			"key": "default",
			"localizedContent": {
				"label": {
					"pt-BR": "Padrão",
					"pt-PT": "Padrão",
					"gn-PY": "Teko",
					"en-US": "Default",
					"es-ES": "Predeterminado",
					"fr-FR": "Défaut"
				}
			}
		}
	]
}
